{
  "id": "6f8e7d2c-1a3b-4c5d-6e7f-8a9b0c1d2e3f",
  "slug": "climber-arborist-labor",
  "version": "1.0.0",
  "created": "2026-07-02T17:30:48.816001",
  "updated": "2026-07-02T17:30:48.816001",
  "trade": "Tree Service",
  "category": "Tree Service",
  "subcategory": "Labor",
  "name": "Climber Arborist Labor Rate",
  "unit": "HR",
  "description": "Standard hourly rate for climbing arborist performing pruning and technical tree dismantling.",
  "laborCost": "75.00",
  "materialCost": "0.00",
  "equipmentCost": "5.00",
  "notes": "Includes standard safety climbing harness and basic ropes.",
  "pricingStatus": "PLACEHOLDER",
  "requiredInputs": [
    "Access width constraints",
    "Crew sizes"
  ],
  "productionNotes": "Double-check overhead electric lines before rigging.",
  "assumptions": [
    "Standard access permitted within 50 feet of job location."
  ],
  "exclusions": [
    "Municipal permit filing fees (unless explicitly selected)."
  ],
  "futurePricingHooks": "Link to diesel price indexes.",
  "confidenceScore": 0.95
}