{
  "id": "bf8e7d2c-1a3b-4c5d-6e7f-8a9b0c1d2e3f",
  "slug": "haul-truck-dump-fee",
  "version": "1.0.0",
  "created": "2026-07-02T17:30:48.816001",
  "updated": "2026-07-02T17:30:48.816001",
  "trade": "Tree Service",
  "category": "Tree Service",
  "subcategory": "Disposal",
  "name": "Haul Truck and Dump Fee",
  "unit": "EA",
  "description": "Flat rate charge per load for truck hauling and municipal bio-mass dumping fee.",
  "laborCost": "25.00",
  "materialCost": "0.00",
  "equipmentCost": "125.00",
  "notes": "Includes haul-away of logs, branches, and wood debris.",
  "pricingStatus": "PLACEHOLDER",
  "requiredInputs": [
    "Access width constraints",
    "Crew sizes"
  ],
  "productionNotes": "Double-check overhead electric lines before rigging.",
  "assumptions": [
    "Standard access permitted within 50 feet of job location."
  ],
  "exclusions": [
    "Municipal permit filing fees (unless explicitly selected)."
  ],
  "futurePricingHooks": "Link to diesel price indexes.",
  "confidenceScore": 0.95
}