{
  "id": "9f8e7d2c-1a3b-4c5d-6e7f-8a9b0c1d2e3f",
  "slug": "large-wood-chipper-operating",
  "version": "1.0.0",
  "created": "2026-07-02T17:30:48.816001",
  "updated": "2026-07-02T17:30:48.816001",
  "trade": "Tree Service",
  "category": "Tree Service",
  "subcategory": "Equipment",
  "name": "Large Wood Chipper Operating Rate",
  "unit": "HR",
  "description": "Hourly operating cost of a towable 12-inch capacity wood chipper, including fuel and blade wear.",
  "laborCost": "0.00",
  "materialCost": "5.00",
  "equipmentCost": "35.00",
  "notes": "Chips tree limbs on site into organic mulch.",
  "pricingStatus": "PLACEHOLDER",
  "requiredInputs": [
    "Access width constraints",
    "Crew sizes"
  ],
  "productionNotes": "Double-check overhead electric lines before rigging.",
  "assumptions": [
    "Standard access permitted within 50 feet of job location."
  ],
  "exclusions": [
    "Municipal permit filing fees (unless explicitly selected)."
  ],
  "futurePricingHooks": "Link to diesel price indexes.",
  "confidenceScore": 0.95
}