{
  "id": "3f8e7d2c-1a3b-4c5d-6e7f-8a9b0c1d2e3f",
  "slug": "light-chainsaw-operating",
  "version": "1.0.0",
  "created": "2026-07-02T17:30:48.816001",
  "updated": "2026-07-02T17:30:48.816001",
  "trade": "Tree Service",
  "category": "Tree Service",
  "subcategory": "Equipment",
  "name": "Light Chainsaw 14-Inch Operating",
  "unit": "HR",
  "description": "Hourly operating cost of light 14-inch pruning chainsaw.",
  "laborCost": "0.00",
  "materialCost": "1.50",
  "equipmentCost": "8.00",
  "notes": "Pruning chainsaw.",
  "pricingStatus": "PLACEHOLDER",
  "requiredInputs": [
    "Access width constraints",
    "Crew sizes"
  ],
  "productionNotes": "Double-check overhead electric lines before rigging.",
  "assumptions": [
    "Standard access permitted within 50 feet of job location."
  ],
  "exclusions": [
    "Municipal permit filing fees (unless explicitly selected)."
  ],
  "futurePricingHooks": "Link to diesel price indexes.",
  "confidenceScore": 0.95
}